{
  "id": "johns-os",
  "name": "johns-os",
  "description": "Local plugin marketplace for John's OS.",
  "version": "0.3.0",
  "updated_at": "2026-08-06T00:00:00Z",
  "plugins": [
    {
      "id": "engineering-lifecycle",
      "record": "marketplace/plugins/engineering-lifecycle.json"
    },
    {
      "id": "business-development",
      "record": "marketplace/plugins/business-development.json"
    },
    {
      "id": "ai-utilities",
      "record": "marketplace/plugins/ai-utilities.json"
    }
  ]
}
